{
  "schema_version": "uet-calculation-contract-v1",
  "contract_id": "T13_NONLINEAR_INVARIANT_FORMAL_V1",
  "profile": "FORMAL",
  "review": {
    "status": "INCOMPLETE",
    "reviewer": "agent:calculation-observation-standard-v1",
    "rationale": "Scoped methodological review; original results are pinned to a distinct local research commit, not integrated or independently rerun in this checkout.",
    "coverage_evidence": [
      "git:0f17012ffd6ad456c150b10e048efd868ce95588:docs/topics/0.13_Thermodynamic_Bridge/Result/T13_INVARIANT_POLE_DISCRIMINATION_2026-10-15.md",
      "git:0f17012ffd6ad456c150b10e048efd868ce95588:docs/topics/0.13_Thermodynamic_Bridge/Result/artifacts/t13_invariant_pole_discrimination.json"
    ]
  },
  "question": "Which existing kernel parameter combinations survive a Phi field-coordinate rescaling?",
  "output": {
    "quantity": "declared scoped result",
    "unit": "dimensionless",
    "domain": "Only the approximation and input domain of the identified source evidence.",
    "accuracy": "Inherit named source tolerances; no new physical accuracy claim.",
    "claim_intent": "FORMAL_RESULT"
  },
  "model": {
    "formula_ids": [
      "K4=L-B/(p-nu^2)",
      "p=a/Z",
      "B=epsilon*h^2/(2*Z)"
    ],
    "assumptions": "Nonzero coupling; distinct real off-pole inputs; source-declared lossless branch.",
    "approximation": "Existing flat homogeneous tree-level normal branch only.",
    "initial_boundary": "Source-defined initial state, boundary and reference; no inferred material state.",
    "drive_environment": "Source-declared controls only; no acquired physical drive.",
    "parameters": "L,p,B are invariant combinations, not new predicted physical constants. Unknown decomposition into h and Z remains separate."
  },
  "data_policy": {
    "uses_observations": false,
    "calibration_ids": [],
    "comparison_ids": [],
    "independent_validation": false,
    "holdout_policy": "No holdout access, fitting, external validation or new blind-eligibility decision."
  },
  "observation": {
    "source_state": "Source-scoped state, not automatically a material state.",
    "generated_trace": "Derived record only; not the full observable state.",
    "carrier": "No physical carrier admitted by this metadata review.",
    "observer_state": "Formal readout or source-described instrument; unknowns are in component ledger.",
    "readout": "Existing source output, no new measurement mapping.",
    "backaction": "No new source/receiver coupling; no claim of complete physical backaction.",
    "frame": "declared source frame",
    "time_convention": "declared source convention",
    "product_level": "formal/synthetic evidence",
    "trace_scope": "not_used",
    "trace_used_as_complete_state": false,
    "corrections": []
  },
  "components": [
    {
      "id": "detector",
      "group": "detector",
      "disposition": "NOT_APPLICABLE",
      "reason": "Outside this bounded formal/synthetic result; no physical measurement claim.",
      "evidence": [
        "git:0f17012ffd6ad456c150b10e048efd868ce95588:docs/topics/0.13_Thermodynamic_Bridge/Result/T13_INVARIANT_POLE_DISCRIMINATION_2026-10-15.md"
      ]
    },
    {
      "id": "drive_environment",
      "group": "drive_environment",
      "disposition": "NOT_APPLICABLE",
      "reason": "Outside this bounded formal/synthetic result; no physical measurement claim.",
      "evidence": [
        "git:0f17012ffd6ad456c150b10e048efd868ce95588:docs/topics/0.13_Thermodynamic_Bridge/Result/T13_INVARIANT_POLE_DISCRIMINATION_2026-10-15.md"
      ]
    },
    {
      "id": "frame_time",
      "group": "frame_time",
      "disposition": "NOT_APPLICABLE",
      "reason": "Outside this bounded formal/synthetic result; no physical measurement claim.",
      "evidence": [
        "git:0f17012ffd6ad456c150b10e048efd868ce95588:docs/topics/0.13_Thermodynamic_Bridge/Result/T13_INVARIANT_POLE_DISCRIMINATION_2026-10-15.md"
      ]
    },
    {
      "id": "numerics",
      "group": "numerics",
      "disposition": "MODELED",
      "reason": "Declared implementation/formal scope in pinned evidence; no material interpretation.",
      "evidence": [
        "git:0f17012ffd6ad456c150b10e048efd868ce95588:docs/topics/0.13_Thermodynamic_Bridge/Result/T13_INVARIANT_POLE_DISCRIMINATION_2026-10-15.md"
      ]
    },
    {
      "id": "processing",
      "group": "processing",
      "disposition": "UNKNOWN",
      "reason": "Clean public lineage integration of the pinned research commit remains open.",
      "evidence": [
        "git:0f17012ffd6ad456c150b10e048efd868ce95588:docs/topics/0.13_Thermodynamic_Bridge/Result/T13_INVARIANT_POLE_DISCRIMINATION_2026-10-15.md"
      ],
      "owner": "EVIDENCE",
      "next_action": "Review/integrate the exact owner evidence or package an authorized portable source before promotion."
    },
    {
      "id": "propagation",
      "group": "propagation",
      "disposition": "NOT_APPLICABLE",
      "reason": "Outside this bounded formal/synthetic result; no physical measurement claim.",
      "evidence": [
        "git:0f17012ffd6ad456c150b10e048efd868ce95588:docs/topics/0.13_Thermodynamic_Bridge/Result/T13_INVARIANT_POLE_DISCRIMINATION_2026-10-15.md"
      ]
    },
    {
      "id": "system_state",
      "group": "system_state",
      "disposition": "MODELED",
      "reason": "Declared implementation/formal scope in pinned evidence; no material interpretation.",
      "evidence": [
        "git:0f17012ffd6ad456c150b10e048efd868ce95588:docs/topics/0.13_Thermodynamic_Bridge/Result/T13_INVARIANT_POLE_DISCRIMINATION_2026-10-15.md"
      ]
    }
  ],
  "error_budget": {
    "unit": "dimensionless",
    "numerical": "Existing saved verifier thresholds; not rerun here.",
    "approximation": "Source approximation only; no physical extension.",
    "measurement": "No independent physical acceptance in this review.",
    "systematic": "Unadmitted physical effects remain limitations.",
    "omissions": "No quantitative physical omission bound asserted.",
    "dependence": "No independence or covariance invented.",
    "acceptance": "Source-scoped formal/diagnostic conclusion only.",
    "omission_limit": null
  },
  "identities": [
    {
      "path": "docs/topics/0.13_Thermodynamic_Bridge/Result/T13_INVARIANT_POLE_DISCRIMINATION_2026-10-15.md",
      "kind": "git_blob",
      "role": "evidence",
      "commit": "0f17012ffd6ad456c150b10e048efd868ce95588",
      "sha256": "84bc32d4887b2639ea8921136a1fa269ce269b865d15549de55129696a05ec6b",
      "availability": "LOCAL_ONLY"
    },
    {
      "path": "docs/topics/0.13_Thermodynamic_Bridge/Result/artifacts/t13_invariant_pole_discrimination.json",
      "kind": "git_blob",
      "role": "evidence",
      "commit": "0f17012ffd6ad456c150b10e048efd868ce95588",
      "sha256": "1ddbb24c126e48f40d6a7abdae765b4fabdced9547f8f07ad3319ec08388a985",
      "availability": "LOCAL_ONLY"
    }
  ],
  "entrypoints": [
    "docs/topics/0.13_Thermodynamic_Bridge/Result/T13_INVARIANT_POLE_DISCRIMINATION_2026-10-15.md"
  ],
  "evidence": [
    "git:0f17012ffd6ad456c150b10e048efd868ce95588:docs/topics/0.13_Thermodynamic_Bridge/Result/T13_INVARIANT_POLE_DISCRIMINATION_2026-10-15.md",
    "git:0f17012ffd6ad456c150b10e048efd868ce95588:docs/topics/0.13_Thermodynamic_Bridge/Result/artifacts/t13_invariant_pole_discrimination.json"
  ],
  "claim_boundary": "Formal inverse/interval design only; ordinary material poles may be equivalent. No acquired kernel, independent SI Phi scale or physical validation.",
  "next_action": "Reuse unchanged evidence; review on source, config, model, observable or scope change."
}
